{
  "operation": "composite",
  "personA": {
    "utc": {
      "year": 2000,
      "month": 1,
      "day": 1,
      "hour": 12,
      "minute": 0
    },
    "location": {
      "latitude": 10.8231,
      "longitude": 106.6297
    },
    "houseSystem": "placidus"
  },
  "personB": {
    "utc": {
      "year": 1998,
      "month": 6,
      "day": 15,
      "hour": 6,
      "minute": 30
    },
    "location": {
      "latitude": 21.0278,
      "longitude": 105.8342
    },
    "houseSystem": "placidus"
  },
  "rulership": "traditional",
  "aspectPreset": "extended",
  "houseMethod": "wholeSignFromMidpointAscendant",
  "antipodalPolicy": "error",
  "domains": [],
  "customProfiles": [
    {
      "id": "sharedGrowth",
      "version": "1.0",
      "houses": [
        1,
        9,
        11
      ],
      "bodies": [
        "sun",
        "mercury",
        "jupiter"
      ],
      "angles": [
        "ascendant"
      ],
      "sections": [
        {
          "id": "learningTogether",
          "houses": [
            3,
            9
          ],
          "bodies": [
            "mercury",
            "jupiter"
          ]
        },
        {
          "id": "sharedResources",
          "houses": [
            2,
            8
          ],
          "bodies": [
            "venus",
            "saturn"
          ]
        }
      ]
    }
  ]
}
